{
  "$schema": "https://json-schema.org/draft/2020-12/schema",
  "$id": "approved_review.schema.json",
  "title": "Approved Review",
  "type": "object",
  "required": ["schema_version", "transaction_id", "run_id", "created_at", "review_data_hash", "payload"],
  "properties": {
    "schema_version": { "type": "string" },
    "transaction_id": { "type": "string" },
    "run_id": { "type": "string" },
    "created_at": { "type": "string" },
    "created_by": { "type": ["string", "null"] },
    "review_data_hash": { "type": "string" },
    "payload": { "type": "object" },
    "warnings": { "type": "array" },
    "errors": { "type": "array" }
  }
}
