{
  "schema_version": "1.0.0",
  "transaction_id": "TR-SMD-0000001",
  "run_id": "run-0001",
  "created_at": "2026-06-09T00:00:00Z",
  "created_by": null,
  "review_data_hash": "sha256-placeholder",
  "payload": {
    "approved": true,
    "approval_note": "placeholder"
  },
  "warnings": [],
  "errors": []
}
